{"fitted_on":{"case_ids":["t01","t02","t03","t04","t05","t06"],"cases_sha256":"41f9fae86ad75f496568a9208710b38db628e42df65ac0e7163d726769b7da47","responses_sha256":"7d6dfadd66d908ffc1bf1c7af6f7c69eba2e320ea7f69163afaac88407de6f2d"},"method":"isotonic","produced_by":{"name":"jevdecision","version":"0.2.0"},"questions":{"department":{"map":{"x":[0.8,0.93],"y":[1.0,1.0]},"n":6,"positives":6,"target":"chosen","type":"choice"},"frustration":{"map":{"x":[0.7,0.95],"y":[1.0,1.0]},"n":6,"positives":6,"target":"chosen","type":"score"},"refund":{"map":{"x":[0.03,0.12,0.91,0.95],"y":[0.0,0.0,1.0,1.0]},"n":6,"positives":2,"target":"yes","type":"noul"}},"schema_version":1}